{
    "introduction": "Welcome to the negotiation table for the 2023 Latest Version Navigation SD Card for Ford/Lincoln GPS systems. The buyers are looking for a product with the best battery condition, ensuring long-lasting use, while the sellers are focused on securing long-term contracts for a sustainable business relationship. With a price of 24.99 USD and a stellar rating of 4.4/5 stars, both parties have their priorities set. Let's navigate through the challenges and reach a mutually beneficial agreement.",
    "product_details": {
        "title": "2023 Latest Version Navigation sd Card Fits Ford/Lincoln Newest GPS Card Updated A14 USA Canada Map-GM5T-19H449-AH",
        "price": 24.99,
        "stars": 4.4,
        "listprice": 24.99
    },
    "participants": [
        {
            "id": "seller-1",
            "name": "Seller-1",
            "role": "seller",
            "personality": {
                "OPE": "-",
                "CON": "++",
                "EXT": "--",
                "AGR": "---",
                "NEU": "-"
            },
            "preferences": {
                "negotiation_style": "aggressive",
                "priorities": "reducing logistics costs",
                "flexibility": {
                    "discount": "10%",
                    "terms": "strict"
                }
            },
            "initial_offer": 30,
            "strategy_description": "### Negotiation Strategy Description\n\n**1. Summary of the Seller's Negotiation Strategy:**\n\nAs a seller focused on reducing logistics costs, my primary strategy centers on leveraging my aggressive negotiation style to maximize profitability while streamlining operations. Given the possibility of a 10% discount, my aim is to secure a target price of $24.99 per unit. Although the budget is not entirely fixed, I intend to adjust financial plans dynamically to enhance overall benefits and improve cost efficiencies. By identifying shared interests with the parties involved, even with my personality\u2014unimaginative, moderately responsible, moderately introverted, very distrustful, and relaxed\u2014I will remain steadfast but calculated in my approach.\n\n**2. Detailed Strategy Description (First-Person Perspective):**\n\nIn this negotiation scenario, my key focus is on reducing logistics costs while ensuring a target price of $24.99 per unit. To achieve this, I commit to an aggressive negotiation style, putting me in a strong position to initiate and steer discussions effectively. Given the complexity of dealing with multiple parties, it's essential to stay assertive yet flexible regarding financial and logistical aspects.\n\nAs a moderately introverted and very distrustful negotiator, I tend to observe the nuances of my counterparts closely, which allows me to pick up on cues that might reveal their underlying priorities. While I prefer not to engage in emotionally charged or frivolous tactics, I will rely on my ability to dispassionately evaluate proposals, focusing squarely on data and outcomes rather than getting sidetracked by external noise that can cloud judgment\u2014after all, I am unimaginative and relaxed, but that serves to keep negotiations clear and direct.\n\nBalancing my moderately responsible nature, I am ready to adjust the proffered 10% discount strategically. Although inclined to dig my heels in during negotiations, I understand that demonstrating willingness to compromise, when absolutely necessary, can lead to favorable agreements that ensure logistical cooperation and cost reduction.\n\nTo reduce logistics costs effectively, I plan to:\n- Establish firm baseline expectations with a clear mandate that aligns closely with my primary goal of logistics optimization.\n- Propose potential logistics partnerships or modified delivery schedules that could induce lower pricing.\n- Tap into and integrate technologies or systems that streamline processes, and present these as non-negotiable components of the deal.\n\nAcknowledging that a moderately introverted and relaxed demeanor might initially seem less dynamic, I maintain a laser focus on crafting precise, well-documented deals that mitigate unforeseen logistics expenses. By adhering strictly to the terms that safeguard my interests, I provide limited room for loopholes that could be exploited later.\n\nIn conclusion, my negotiation strategy is to exploit my strengths in remaining composed, direct, and unyielding on matters of cost while adapting to necessary financial conditions. Albeit aggressive, it perfectly aligns with my distrustful nature\u2014ensuring that I secure a deal that maximizes benefits and minimizes logistics expenditures."
        },
        {
            "id": "seller-2",
            "name": "Seller-2",
            "role": "seller",
            "personality": {
                "OPE": "++",
                "CON": "--",
                "EXT": "--",
                "AGR": "---",
                "NEU": "--"
            },
            "preferences": {
                "negotiation_style": "cooperative",
                "priorities": "balancing production with demand",
                "flexibility": {
                    "discount": "20%",
                    "terms": "strict"
                }
            },
            "initial_offer": 29,
            "strategy_description": "### Negotiation Strategy Description\n\n#### Summary\nAs a seller in a multi-party bargaining scenario, my focus is on balancing production with demand while maintaining a cooperative negotiation style. I am open to offering a 20% discount to seal a deal but will aim to achieve a target price of $24.99 per unit. My strategy is influenced by my personality traits: moderately imaginative, moderately irresponsible, moderately introverted, very distrustful, and moderately relaxed. Despite having a distrustful nature, my approach will be underpinned by an intent to understand the perspectives of all parties involved to build a mutually beneficial agreement. By leveraging my imagination and relaxation in negotiations, I plan to be flexible with my budget to optimize the outcomes.\n\n#### Detailed Strategy\n\n1. **Initial Assessment and Goal Setting**  \n   I will begin by assessing the needs and desires of each party involved in the negotiation. Understanding their objectives will provide insight into how my product aligns with their goals. My own goal is to reach a selling price around $24.99 while being open to adjustments if it ensures a beneficial compromise.\n\n2. **Building Trust through Cooperation**  \n   Despite my tendency to be very distrustful, I will commit to a cooperative negotiation style. This means focusing on open communication and expressing genuine interest in finding solutions that work for everyone. I aim to initiate dialogue that prioritizes transparency regarding production capacities and deadlines, which will help in aligning with demand accurately.\n\n3. **Leveraging Imagination and Balanced Flexibility**  \n   My moderately imaginative nature enables me to think creatively about package deals or custom solutions that appeal to different parties' unique needs. While some might deem this moderately irresponsible, I see it as an opportunity to stand out by offering innovative options that competitors might overlook. This flexibility can lead to improved sales volumes which, in turn, can justify providing up to a 20% discount.\n\n4. **Effective Communication**  \n   Being moderately introverted means I prefer smaller, focused conversations. I will ensure that discussions remain relevant and centered on achieving mutual benefits. I'll also use written communication effectively, framing offers in a way that underscores their advantages, thus reducing potential misunderstandings front-loaded by distrust.\n\n5. **Offer Structuring and Discount Management**  \n   My moderately relaxed nature allows me to handle negotiations with calm demeanor, which will aid in structured offer presentations. If resistance is met, I'm prepared to discuss how a 20% discount aligns with their budget constraints while still supporting our production goals. This is where my flexibility in adjusting the budget comes into play, especially in high-demand scenarios where volume offsets lower margins.\n\n6. **Fostering Long-Term Relationships**  \n   Ultimately, my distrustful trait leads me to prioritize negotiating terms that ensure reliability, such as payment clauses or future collaboration agreements. Building long-term relationships is essential not just for trust-building, but for consistent demand that aligns with production capabilities.\n\nBy integrating these strategies, I aim to effectively balance production and demand, achieve favorable pricing, and establish enduring partnerships that facilitate business growth."
        },
        {
            "id": "buyer-1",
            "name": "Buyer-1",
            "role": "buyer",
            "personality": {
                "OPE": "---",
                "CON": "--",
                "EXT": "++",
                "AGR": "+",
                "NEU": "-"
            },
            "preferences": {
                "negotiation_style": "neutral",
                "priorities": "scalability and premium features",
                "flexibility": {
                    "initial_budget": 21,
                    "terms": "negotiable"
                }
            },
            "initial_offer": 21,
            "strategy_description": "### Negotiation Strategy for Multi-Party Bargaining Scenario\n\n---\n\n#### Summary of Strategy:\n\nAs a buyer in a multi-party bargaining scenario, my primary negotiation focus is on securing a deal that emphasizes \"scalability and premium features.\" I am adopting a neutral negotiation style, meaning I approach discussions without extreme aggression or unwarranted concessions, remaining open-minded and adaptable. My initial budget is set at 21, but I am prepared to adjust this within reason to maximize the long-term benefits of scalability and premium features.\n\nWith a personality that is very unimaginative, moderately irresponsible, moderately extraverted, trustful, and relaxed, my strategy is centered around clear and straightforward communication, fostering trust, and leveraging my extraversion to build rapport with parties involved. This involves being open to exploring creative solutions presented by others, while not necessarily crafting these myself due to my unimaginative nature. I aim to maintain a relaxed and composed demeanor to create a positive negotiation atmosphere.\n\n#### Detailed Strategy Description:\n\n1. **Preparation and Research**:\n   - Before engaging with the parties, I thoroughly research the offerings and competitive landscape related to scalability and premium features. Understanding what each seller potentially offers allows me to identify where I can find the best fit for my needs.\n   - I anticipate different scenarios that may arise and prepare flexible approaches to shift my budget slightly, while maintaining focus on the core priorities.\n\n2. **Initial Engagement**:\n   - I initiate conversations by expressing genuine interest in all parties' offerings. Thanks to my moderately extraverted personality, I use my communication skills to break the ice and establish rapport.\n   - I ensure transparency about my interest in scalability and premium features, making it clear that these are non-negotiable priorities.\n\n3. **Exploring Options**:\n   - Having a moderately irresponsible streak, I allow myself the freedom to explore various options, perhaps even those slightly outside my initial considerations. However, I constantly weigh these against the priority features.\n   - I actively listen to what each party can offer specifically related to scalability and features, asking probing questions to capture detailed insights and identifying gaps or distinguishing factors.\n\n4. **Building Trust and Rapport**:\n   - I leverage my trustful nature by assuming good intentions from the other parties, which encourages them to be transparent and collaborative in return. This approach also aligns with my relaxed demeanor, helping to diffuse any tension.\n   - My focus is on collaborative problem-solving, contributing to joint decisions that allow all parties to feel involved in the solution-building process.\n\n5. **Price Negotiation**:\n   - While I begin negotiations with an initial budget of 21, I remain open to slight adjustments. My primary goal is maximizing the value of scalability and premium features, even if it requires reallocating my expenditure priorities.\n   - Whenever possible, instead of just competing on price, I explore other creative compensations like extended warranties or enhanced support services, which may come at no additional cost.\n\n6. **Decision and Agreement**:\n   - As talks progress, I monitor the alignment of offers with my primary goal of scalability and premium features. I am willing to stretch my budget slightly if the solution promises superior long-term benefits.\n   - Final decisions are made after careful consideration of the added value, relationships built, and potential for future collaboration or expansion, ensuring every invested penny maximizes our strategic objectives.\n\nBy balancing my relaxed and extraverted nature with strategic preparation and focus on trust, I cultivate an advantageous position that empowers me to close the deal effectively, ensuring both immediate and future needs are met."
        },
        {
            "id": "buyer-2",
            "name": "Buyer-2",
            "role": "buyer",
            "personality": {
                "OPE": "++",
                "CON": "-",
                "EXT": "+++",
                "AGR": "+++",
                "NEU": "-"
            },
            "preferences": {
                "negotiation_style": "aggressive",
                "priorities": "timely delivery",
                "flexibility": {
                    "initial_budget": 19,
                    "terms": "negotiable"
                }
            },
            "initial_offer": 19,
            "strategy_description": "### Negotiation Strategy Summary\n\nAs a buyer with a clear priority on timely delivery, my primary objective in this multi-party bargaining scenario is to ensure that delivery timelines are strictly adhered to while securing the best possible price. Given my aggressive negotiation style, I plan to leverage assertiveness and direct communication to keep other parties aligned with my delivery expectations. My initial budget is set at 19, but I'm flexible enough to adjust it slightly to prioritize time-bound commitments. My personality is characterized by being moderately imaginative, somewhat irresponsible, very extraverted, highly trustful, and relaxed, which will influence my approach. In particular, my extraversion will aid in domineering negotiations, while my trustfulness will allow for open, transparent dialogues. I'll strategically use my imaginative thinking to devise creative solutions for any impasses and maintain a relaxed demeanor to manage stress effectively throughout negotiations.\n\n### Strategy Description\n\n**1. Establishing Dominance Early:**\nFrom the start, I\u2019ll employ my aggressive negotiation style by clearly articulating my non-negotiable priority: timely delivery. I will initiate the conversation by setting firm expectations around delivery dates. This upfront positioning will help other parties understand the critical nature of my requirements and set the stage for discussions.\n\n**2. Building Rapport and Leveraging Trust:**\nGiven my very trustful nature and extraverted personality, I\u2019ll focus on building genuine rapport with the other parties. This approach will not only create an atmosphere of openness but also facilitate meaningful exchange of information. My trustfulness will encourage other parties to reciprocate in kind, allowing for an honest dialogue about capabilities and constraints.\n\n**3. Creative Problem Solving:**\nAs someone moderately imaginative, I\u2019ll engage this trait by proposing unique solutions that could help achieve timely deliveries, even at a slightly higher cost, thereby offering a better value proposition. This approach may include flexible logistics arrangements or incentivized bottleneck breakpoints, which could ensure the quick turnaround I seek.\n\n**4. Establishing Negotiation Anchors:**\nI\u2019ll aggressively anchor discussions around timely delivery as the cornerstone of our agreement but express flexibility in pricing to signal my willingness to secure the best possible terms. My initial budget cap is 19, yet my comfort with slightly elevating that budget, contingent upon solid assurances of timely delivery, can infuse the negotiation with more complexity, making other parties more earnest in their offerings.\n\n**5. Harnessing Relaxation in Responses:**\nBeing naturally relaxed, I will maintain my composure even when disagreements arise. This steadiness can convey confidence, discouraging any attempts to exploit perceived pressure points. Staying calm will also help in listening actively and understanding any valid concerns voiced by other parties.\n\n**6. Reassessing and Adjusting:**\nFinally, I\u2019ll be prepared to reassess and adjust throughout the negotiations. If a party introduces a compromise that aligns with the desired delivery date but requires a tweak in budget allocation, my flexibility will allow for budgetary adjustments to maximize the overall outcome.\n\nIn conclusion, my strategy revolves around placing a non-compromising emphasis on timely delivery while maintaining a flexible budget approach. Leveraging my personal attributes, I aim to conduct assertive yet friendly discussions to secure favorable terms by striking a balance between my key priorities and the dynamic components of negotiation."
        }
    ]
}